,Course id,English title,Danish title,Point( ECTS ),Course type,Location,Recommended prerequisites,Responsible,Department,Link
1214,42142,Recent Research Results in Management Science,Recent Research Results in Management Science,"2,5","Ph.D., Professional identity course_Offered as a single course","Campus Lyngby DTU Management, Produktionstorvet, building 358, room 030every second Thursday at 13.00","42101,  , General knowledge of Operationsresearch and mathematical programming eg. ""introduction tooperations research""",David Pisinger,"42 Department of Technology, Management and Economics",https://kurser.dtu.dk/course/42142
1215,42178,Transport system analysis - demand and planning,Analyse af transportsystemer - efterspørgsel ogplanlægning,5,"MSc_Offered as a single course_General competence course, MSc. Eng., Transportation and Logistics",Campus Lyngby,"02323,02402,02403, /,/, , or similar statistics   course",Stefan Eriksen Mabit,"42 Department of Technology, Management and Economics",https://kurser.dtu.dk/course/42178
1216,42180,Quantitative modelling of behaviour,Kvantitativ modellering af adfærd,5,"MSc_Offered as a single course_Technological specialization course, MSc. Eng., Business Analytics_Technological specialization course, MSc. Eng., Sustainable Energy_Technological specialization course, MSc. Eng., Industrial Engineering and Management_Technological specialization course, MSc. Eng., Transportation and Logistics",Campus Lyngby,"02402,02403,02323, /,/, , or similar introduction course to   statistics.",Anders Fjendbo Jensen,"42 Department of Technology, Management and Economics",https://kurser.dtu.dk/course/42180
1217,42184,Data Science for Mobility,Data science inden for mobilitet,5,"MSc_General competence course, MSc. Eng., Transportation and Logistics_Technological specialization course, MSc. Eng., Transportation and Logistics",Campus Lyngby,"02402,02403,02105, /,/, , Introductory courses in   statistics are very important (programming is also very   desirable, but not fundamental)",Filipe M Pereira Duarte Rodrigues,"42 Department of Technology, Management and Economics",https://kurser.dtu.dk/course/42184
1218,42185,Planning and Modelling of Public Transport,Planlægning og modellering af kollektiv trafik,5,"MSc_Technological specialization course, MSc. Eng., Transportation and Logistics",Only online.,"42401,42101, /",Otto Anker Nielsen,"42 Department of Technology, Management and Economics",https://kurser.dtu.dk/course/42185
1219,42186,Model-based machine learning,Model-based machine learning,5,"MSc_General competence course, MSc. Eng., Business Analytics_Technological specialization course, MSc. Eng., Business Analytics_Technological specialization course, MSc. Eng., Industrial Engineering and Management_Technological specialization course, MSc. Eng., Mathematical Modelling and Computing_Technological specialization course, MSc. Eng., Transportation and Logistics",Campus Lyngby,"02806,02450,02807,42184,02402,02403, /,/,/,/,/, , Good probability, statistics and   programming bases are highly   recommended.",Filipe M Pereira Duarte Rodrigues,"42 Department of Technology, Management and Economics",https://kurser.dtu.dk/course/42186
1220,42187,"Transport System Analysis: Performance and
Operations",Analyse af transportsystemer: Udbud og Modellering,5,"MSc_Offered as a single course_General competence course, MSc. Eng., Transportation and Logistics",Campus Lyngby,", Basic statistics/probability theory.; Basic calculus (02323 /02402 / 02403 or similar courses; 01901/01920 or similarcourses)",Thomas Kjær Rasmussen,"42 Department of Technology, Management and Economics",https://kurser.dtu.dk/course/42187
1221,42188,Agent-based modelling and simulation,Simulation og modelllering af agent-baserede systemer,5,"MSc_Offered as a single course_Technological specialization course, MSc. Eng., Transportation and Logistics",Campus Lyngby,"42180,02441,02409,  /, /, , Or similar statistical courses. Itis a requirement that the students have basic mathematicalprogramming experience (e.g.: R and Phyton). A certain level ofmathematical understanding is also arequirement.",Jeppe Rich,"42 Department of Technology, Management and Economics",https://kurser.dtu.dk/course/42188
1222,42251,"Sustainable Development Indicators and Sustainable Urban
Development",Bæredygtighedsindikatorer og bæredygtig byudvikling,5,"MSc_Technological specialization course, MSc. Eng., Environmental Engineering_Technological specialization course, MSc. Eng., Transportation and Logistics",Campus Lyngby,,Per Sieverts Nielsen,"42 Department of Technology, Management and Economics",https://kurser.dtu.dk/course/42251
1223,42283,Smart Cities,Smarte byer,5,"MSc_Offered as a single course_General competence course, MSc. Eng., Architectural Engineering_Technological specialization course, MSc. Eng., Transportation and Logistics",Campus Lyngby,,Francisco Camara Pereira,"42 Department of Technology, Management and Economics",https://kurser.dtu.dk/course/42283
1224,42380,Supply Chain Analytics,Supply Chain Analytics,5,"MSc_General competence course, MSc. Eng., Transportation and Logistics_Technological specialization course, MSc. Eng., Business Analytics_Technological specialization course, MSc. Eng., Industrial Engineering and Management_Technological specialization course, MSc. Eng., Transportation and Logistics",Campus Lyngby,"42101,02402,02403,42402,42587, .­,/,.­,/, , (or similar introductory courses   in OR, statistics and SCM). It is expected that participants   have some basic programming skills in languages such as R,   Python, Matlab, Julia, or similar.",Allan Larsen,"42 Department of Technology, Management and Economics",https://kurser.dtu.dk/course/42380
1225,42381,Sustainable Freight and Transport Logistics,Bæredygtig godstransport og transportlogistik,5,"MSc_Offered as a single course_Technological specialization course, MSc. Eng., Industrial Engineering and Management_Technological specialization course, MSc. Eng., Transportation and Logistics",Campus Lyngby,", At least 2 years of bachelor’s study",Charilaos Psaraftis,"42 Department of Technology, Management and Economics",https://kurser.dtu.dk/course/42381
1226,42382,Industry 4.0 in Operations Management,Industry 4.0 in Operations Management,5,"MSc_Technological specialization course, MSc. Eng., Industrial Engineering and Management",Campus Lyngby,"42380,42402,42417, .,/, , This is considered an advanced OM   course and the intention is that it is taken in the final   semester of a master study. It is further expected that   participants have some basic programming skills in languages   such as R, Python, Matlab, Julia, or   similar.",Allan Larsen,"42 Department of Technology, Management and Economics",https://kurser.dtu.dk/course/42382
1227,42402,"Sustainable Operations and Supply Chain Management
(O&SCM)",Bæredygtig Operations og supply chain management(O&SCM),5,"MSc_Offered as a single course_General competence course, MSc. Eng., Industrial Engineering and Management_General competence course, MSc. Eng., Transportation and Logistics_Technological specialization course, MSc. Eng., Design and Innovation",Campus Lyngby,,Allan Larsen,"42 Department of Technology, Management and Economics",https://kurser.dtu.dk/course/42402
1228,42417,Simulation in Operations Management,Simulering i operations management,5,"MSc_Offered as a single course_General competence course, MSc. Eng., Business Analytics_General competence course, MSc. Eng., Industrial Engineering and Management_General competence course, MSc. Eng., Transportation and Logistics_Technological specialization course, MSc. Eng., Business Analytics_Technological specialization course, MSc. Eng., Industrial Engineering and Management_Technological specialization course, MSc. Eng., Transportation and Logistics",Campus Lyngby,"02402,02403,02405, /,/, , Introduction to statistics (or   similar course in statistics and/or probability theory). Basic   knowledge of programming (such as ""if-then-else""   statements and ""for"" loops).",Allan Larsen,"42 Department of Technology, Management and Economics",https://kurser.dtu.dk/course/42417
1229,42421,Management and Organization,Ledelse og organisation,5,"BSc_Technology Core Courses, Data Science and Management",Campus Lyngby,,Liisa Johanna Välikangas,"42 Department of Technology, Management and Economics",https://kurser.dtu.dk/course/42421
1230,42429,Project Management,Projektledelse,5,"BSc_MSc_Offered as a single course_Mandatory course, Bachelor of Engineering Mobility, Transport and Logistics_Mandatory course, Bachelor of Engineering Manufacturing and Management_Technology Core Courses, Data Science and Management_Technological specialization course, MSc. Eng., Business Analytics_Technological specialization course, MSc. Eng., Design and Innovation_Technological specialization course, MSc. Eng., Transportation and Logistics",Campus Lyngby,,Christian Thuesen,"42 Department of Technology, Management and Economics",https://kurser.dtu.dk/course/42429
1231,42430,Project Management,Projektledelse,5,"BSc_MSc_Offered as a single course_Mandatory course, Bachelor of Engineering Mobility, Transport and Logistics_Technology Core Courses, Data Science and Management_Technological specialization course, MSc. Eng., Business Analytics",Campus Lyngby,,Christian Thuesen,"42 Department of Technology, Management and Economics",https://kurser.dtu.dk/course/42430
1232,42433,"Advanced Engineering Project, Program and Portfolio
Management","Avanceret ledelse af ingeniørprojekter, programmer ogporteføljer",10,"MSc_Offered as a single course_Technological specialization course, MSc. Eng., Design and Innovation_Technological specialization course, MSc. Eng., Industrial Engineering and Management_Technological specialization course, MSc. Eng., Architectural Engineering_Technological specialization course, MSc. Eng., Petroleum Engineering_Technological specialization course, MSc. Eng., Transportation and Logistics",Campus Lyngby,"42429,42430,42421,42922,42490, /,/,/,/",Josef Oehmen,"42 Department of Technology, Management and Economics",https://kurser.dtu.dk/course/42433
1233,42500,Innovation in Engineering,Innovation in Engineering,5,"MSc_General competence course, MSc. Eng., Applied Chemistry_General competence course, MSc. Eng., Business Analytics_General competence course, MSc. Eng., Quantitative Biology and Disease Modelling_General competence course, MSc. Eng., Autonomous Systems_General competence course, MSc. Eng., Bioinformatics Systems Biology_General competence course, MSc. Eng. Biomaterial Engineering for Medicine_General competence course, MSc. Eng., Biotechnology_General competence course, MSc. Eng., Civil Engineering_General competence course, MSc. Eng. Sustainable Fisheries and Aquaculture_General competence course, MSc. Eng., Electrical Engineering_General competence course, MSc. Eng., Pharmaceutical Design and Engineering_General competence course, MSc. Eng. Engineering Physics_General competence course, MSc. Eng., Food Technology_General competence course, MSc. Eng., Earth and Space Physics Engineering_General competence course, MSc. Eng., Computer Science and Engineering_General competence course, MSc. Eng., Communication Technologies and System Design_General competence course, MSc. Eng. Engineering Light_General competence course, MSc. Eng., Mathematical Modelling and Computing_General competence course, MSc. Eng., Wind Energy_General competence course, MSc. Eng., Architectural Engineering_General competence course, MSc. Eng., Sustainable Energy_General competence course, MSc. Eng., Chemical and Biochemical Engineering_General competence course, MSc. Eng., Mechanical Engineering_General competence course, MSc. Eng., Materials and Manufacturing Engineering_General competence course, MSc. Eng., Biomedical Engineering_General competence course, MSc. Eng., Human-Centered Artificial Intelligence_General competence course, MSc. Eng., Environmental Engineering_General competence course, MSc. Eng., Petroleum Engineering_General competence course, MSc. Eng., Transportation and Logistics_eneral competence course, MSc. Eng., Industrial Engineering and Management_eneral competence course, MSc. Eng., Engineering Acoustics","Campus Lyngby The course will take place on Lyngby Campus, including allgroup work. Part of the teaching will take place via an onlineplatform (DTU Learn).",,Winnie Edith Svendsen,"42 Department of Technology, Management and Economics",https://kurser.dtu.dk/course/42500
1234,42501,Innovation in Engineering,Innovation in Engineering,5,"MSc_General competence course, MSc. Eng., Applied Chemistry_General competence course, MSc. Eng., Business Analytics_General competence course, MSc. Eng., Quantitative Biology and Disease Modelling_General competence course, MSc. Eng., Autonomous Systems_General competence course, MSc. Eng., Bioinformatics Systems Biology_General competence course, MSc. Eng. Biomaterial Engineering for Medicine_General competence course, MSc. Eng., Biotechnology_General competence course, MSc. Eng., Civil Engineering_General competence course, MSc. Eng. Sustainable Fisheries and Aquaculture_General competence course, MSc. Eng., Electrical Engineering_General competence course, MSc. Eng., Pharmaceutical Design and Engineering_General competence course, MSc. Eng. Engineering Physics_General competence course, MSc. Eng., Food Technology_General competence course, MSc. Eng., Earth and Space Physics Engineering_General competence course, MSc. Eng., Computer Science and Engineering_General competence course, MSc. Eng., Communication Technologies and System Design_General competence course, MSc. Eng. Engineering Light_General competence course, MSc. Eng., Mathematical Modelling and Computing_General competence course, MSc. Eng., Wind Energy_General competence course, MSc. Eng., Architectural Engineering_General competence course, MSc. Eng., Sustainable Energy_General competence course, MSc. Eng., Chemical and Biochemical Engineering_General competence course, MSc. Eng., Mechanical Engineering_General competence course, MSc. Eng., Materials and Manufacturing Engineering_General competence course, MSc. Eng., Biomedical Engineering_General competence course, MSc. Eng., Human-Centered Artificial Intelligence_General competence course, MSc. Eng., Environmental Engineering_General competence course, MSc. Eng., Petroleum Engineering_General competence course, MSc. Eng., Transportation and Logistics_eneral competence course, MSc. Eng., Industrial Engineering and Management","Campus Lyngby The course will take place on Lyngby Campus, including allgroup work. Part of the teaching will take place via an onlineplatform (DTU Learn).",,Matteo Calaon,"42 Department of Technology, Management and Economics",https://kurser.dtu.dk/course/42501
1235,42502,Facilitating Innovation in Multidisciplinary Teams,Facilitating Innovation in Multidisciplinary Teams,5,"MSc_General competence course, MSc. Eng., Applied Chemistry_General competence course, MSc. Eng., Business Analytics_General competence course, MSc. Eng., Quantitative Biology and Disease Modelling_General competence course, MSc. Eng., Autonomous Systems_General competence course, MSc. Eng., Bioinformatics Systems Biology_General competence course, MSc. Eng. Biomaterial Engineering for Medicine_General competence course, MSc. Eng., Civil Engineering_General competence course, MSc. Eng., Design and Innovation_General competence course, MSc. Eng., Electrical Engineering_General competence course, MSc. Eng., Pharmaceutical Design and Engineering_General competence course, MSc. Eng. Engineering Physics_General competence course, MSc. Eng., Earth and Space Physics Engineering_General competence course, MSc. Eng., Computer Science and Engineering_General competence course, MSc. Eng., Communication Technologies and System Design_General competence course, MSc. Eng., Wind Energy_General competence course, MSc. Eng., Sustainable Energy_General competence course, MSc. Eng., Mechanical Engineering_General competence course, MSc. Eng., Materials and Manufacturing Engineering_General competence course, MSc. Eng., Biomedical Engineering_General competence course, MSc. Eng., Human-Centered Artificial Intelligence_General competence course, MSc. Eng., Environmental Engineering_General competence course, MSc. Eng., Transportation and Logistics_eneral competence course, MSc. Eng., Industrial Engineering and Management_eneral competence course, MSc. Eng., Engineering Acoustics","Campus Lyngby The course will take place on Lyngby Campus, including allgroup work. Part of the teaching will take place via an onlineplatform (DTU Learn).",,Winnie Edith Svendsen,"42 Department of Technology, Management and Economics",https://kurser.dtu.dk/course/42502
1236,42503,Facilitating Innovation in Multidisciplinary teams,Facilitating Innovation in Multidisciplinary teams,5,"MSc_General competence course, MSc. Eng., Applied Chemistry_General competence course, MSc. Eng., Business Analytics_General competence course, MSc. Eng., Quantitative Biology and Disease Modelling_General competence course, MSc. Eng., Autonomous Systems_General competence course, MSc. Eng., Bioinformatics Systems Biology_General competence course, MSc. Eng. Biomaterial Engineering for Medicine_General competence course, MSc. Eng., Civil Engineering_General competence course, MSc. Eng., Design and Innovation_General competence course, MSc. Eng., Electrical Engineering_General competence course, MSc. Eng., Pharmaceutical Design and Engineering_General competence course, MSc. Eng. Engineering Physics_General competence course, MSc. Eng., Earth and Space Physics Engineering_General competence course, MSc. Eng., Computer Science and Engineering_General competence course, MSc. Eng., Communication Technologies and System Design_General competence course, MSc. Eng., Wind Energy_General competence course, MSc. Eng., Sustainable Energy_General competence course, MSc. Eng., Mechanical Engineering_General competence course, MSc. Eng., Materials and Manufacturing Engineering_General competence course, MSc. Eng., Biomedical Engineering_General competence course, MSc. Eng., Human-Centered Artificial Intelligence_General competence course, MSc. Eng., Environmental Engineering_General competence course, MSc. Eng., Transportation and Logistics_eneral competence course, MSc. Eng., Industrial Engineering and Management_Generel competence course, MSc. Technology Entrepreneurship","Campus Lyngby The course will take place on Lyngby Campus, including allgroup work. Part of the teaching will take place via an onlineplatform (DTU Learn).",,Matteo Calaon,"42 Department of Technology, Management and Economics",https://kurser.dtu.dk/course/42503
1237,42504,Innovation in Engineering,Innovation in Engineering,5,"MSc_General competence course, MSc. Eng., Applied Chemistry_General competence course, MSc. Eng., Business Analytics_General competence course, MSc. Eng., Quantitative Biology and Disease Modelling_General competence course, MSc. Eng., Autonomous Systems_General competence course, MSc. Eng., Bioinformatics Systems Biology_General competence course, MSc. Eng. Biomaterial Engineering for Medicine_General competence course, MSc. Eng., Biotechnology_General competence course, MSc. Eng., Civil Engineering_General competence course, MSc. Eng. Sustainable Fisheries and Aquaculture_General competence course, MSc. Eng., Electrical Engineering_General competence course, MSc. Eng., Pharmaceutical Design and Engineering_General competence course, MSc. Eng. Engineering Physics_General competence course, MSc. Eng., Food Technology_General competence course, MSc. Eng., Earth and Space Physics Engineering_General competence course, MSc. Eng., Computer Science and Engineering_General competence course, MSc. Eng., Communication Technologies and System Design_General competence course, MSc. Eng. Engineering Light_General competence course, MSc. Eng., Mathematical Modelling and Computing_General competence course, MSc. Eng., Wind Energy_General competence course, MSc. Eng., Architectural Engineering_General competence course, MSc. Eng., Sustainable Energy_General competence course, MSc. Eng., Chemical and Biochemical Engineering_General competence course, MSc. Eng., Mechanical Engineering_General competence course, MSc. Eng., Materials and Manufacturing Engineering_General competence course, MSc. Eng., Biomedical Engineering_General competence course, MSc. Eng., Human-Centered Artificial Intelligence_General competence course, MSc. Eng., Environmental Engineering_General competence course, MSc. Eng., Petroleum Engineering_General competence course, MSc. Eng., Transportation and Logistics_eneral competence course, MSc. Eng., Industrial Engineering and Management_eneral competence course, MSc. Eng., Engineering Acoustics","Campus Lyngby The course will take place on Lyngby Campus, including allgroup work. Part of the teaching will take place via an onlineplatform (DTU Learn).",,Jaap Daalhuizen,"42 Department of Technology, Management and Economics",https://kurser.dtu.dk/course/42504
1238,42505,Facilitating Innovation in Multidisciplinary teams,Facilitating Innovation in Multidisciplinary teams,5,"MSc_General competence course, MSc. Eng., Applied Chemistry_General competence course, MSc. Eng., Business Analytics_General competence course, MSc. Eng., Quantitative Biology and Disease Modelling_General competence course, MSc. Eng., Autonomous Systems_General competence course, MSc. Eng., Bioinformatics Systems Biology_General competence course, MSc. Eng. Biomaterial Engineering for Medicine_General competence course, MSc. Eng., Civil Engineering_General competence course, MSc. Eng., Design and Innovation_General competence course, MSc. Eng., Electrical Engineering_General competence course, MSc. Eng., Pharmaceutical Design and Engineering_General competence course, MSc. Eng. Engineering Physics_General competence course, MSc. Eng., Earth and Space Physics Engineering_General competence course, MSc. Eng., Computer Science and Engineering_General competence course, MSc. Eng., Communication Technologies and System Design_General competence course, MSc. Eng., Wind Energy_General competence course, MSc. Eng., Sustainable Energy_General competence course, MSc. Eng., Mechanical Engineering_General competence course, MSc. Eng., Materials and Manufacturing Engineering_General competence course, MSc. Eng., Biomedical Engineering_General competence course, MSc. Eng., Human-Centered Artificial Intelligence_General competence course, MSc. Eng., Environmental Engineering_General competence course, MSc. Eng., Transportation and Logistics_eneral competence course, MSc. Eng., Industrial Engineering and Management_eneral competence course, MSc. Eng., Engineering Acoustics_Generel competence course, MSc. Technology Entrepreneurship","Campus Lyngby The course will take place on Lyngby Campus, including allgroup work. Part of the teaching will take place via an onlineplatform (DTU Learn).",,Winnie Edith Svendsen,"42 Department of Technology, Management and Economics",https://kurser.dtu.dk/course/42505
1239,42543,Management of organizational change,Ledelse af organisatorisk forandring,5,"MSc_General competence course, MSc. Eng., Industrial Engineering and Management_Technological specialization course, MSc. Eng., Business Analytics_Technological specialization course, MSc. Eng., Design and Innovation_Technological specialization course, MSc. Eng., Industrial Engineering and Management",This is a 100% online course,", Bachelor in Engineering Management, Design and Innovation orequivalent",Christine Ipsen,"42 Department of Technology, Management and Economics",https://kurser.dtu.dk/course/42543
1240,42576,From Analytics to Action,From Analytics to Action,5,"MSc_General competence course, MSc. Eng., Business Analytics_General competence course, MSc. Eng., Civil Engineering_General competence course, MSc. Eng., Mathematical Modelling and Computing",Campus Lyngby,"42577,  , The course requires a basicunderstanding of data analytics methods. Furthermore, basicmanagement knowledge is useful to follow thecourse.",Kathrin Kirchner,"42 Department of Technology, Management and Economics",https://kurser.dtu.dk/course/42576
1241,42577,Introduction to Business Analytics,Introduktion til Business Analytics,5,"MSc_General competence course, MSc. Eng., Business Analytics_General competence course, MSc. Eng., Civil Engineering_Technological specialization course, MSc. Eng., Petroleum Engineering",Campus Lyngby,"02402,02403,02105, /,/, , Introductory courses in   statistics are very important (programming is also very   desirable, but not fundamental)",Filipe M Pereira Duarte Rodrigues,"42 Department of Technology, Management and Economics",https://kurser.dtu.dk/course/42577
1242,42578,Advanced Business Analytics,Advanced Business Analytics,5,"MSc_General competence course, MSc. Eng., Business Analytics_Technological specialization course, MSc. Eng., Transportation and Logistics",Campus Lyngby,"42577, ",Francisco Camara Pereira,"42 Department of Technology, Management and Economics",https://kurser.dtu.dk/course/42578
1243,42580,Engineering work - Data Science and Management,Ingeniørarbejde - Data Science og Management,5,"BSc_Projects and General Subjects, Data Science and Management",Campus Lyngby,,Thomas Kjær Rasmussen,"42 Department of Technology, Management and Economics",https://kurser.dtu.dk/course/42580
1244,42584,Project work - Data Science and Management,Fagprojekt - Data Science og Management,10,"BSc_Projects and General Subjects, Data Science and Management",Campus Lyngby,", At least 4 of the technology cores courses shall bepassed.",Mikkel Thorhauge,"42 Department of Technology, Management and Economics",https://kurser.dtu.dk/course/42584
