,Course id,English title,Danish title,Point( ECTS ),Course type,Location,Recommended prerequisites,Responsible,Department,Link
390,22052,Applied signal processing,Anvendt signalbehandling,10,BSc_Offered as a single course,Campus Lyngby,"02402,02403,02405,31605,22050, (,/,/,).­(,/,) , 1. Linear systems or basic   signal analysis and introductory statistics. 2. Students should   have prior knowledge in Matlab.",Sadasivan Puthusserypady,22 Departmentof Health Technology,https://kurser.dtu.dk/course/22052
391,22053,Principles of brain computer interface,Principper for hjerne-computer interface,5,"MSc_Offered as a single course_Technological specialization course, MSc. Eng., Biomedical Engineering",Campus Lyngby,"31561,22052,31545,22485,31560,22055, (,/,).­(,/,)/(,/,)",Sadasivan Puthusserypady,22 Departmentof Health Technology,https://kurser.dtu.dk/course/22053
392,22054,Literature study in biomedical signal analysis,Litteraturstudie i medikoteknisk signalanalyse,5,"Ph.D., Professionally focussed course",Campus Lyngby,,Sadasivan Puthusserypady,22 Departmentof Health Technology,https://kurser.dtu.dk/course/22054
393,22055,"Advanced signal processing with biomedical
applications",Videregående signalbehandling med medicinskeanvendelser,10,"MSc_Offered as a single course_Technological specialization course, MSc. Eng., Biomedical Engineering",Campus Lyngby,"22052, ",Helge Bjarup Dissing Sørensen,22 Departmentof Health Technology,https://kurser.dtu.dk/course/22055
394,22056,Personal portable health technologies,Personlige bærbare sundhedsteknologier,10,"MSc_Offered as a single course_Technological specialization course, MSc. Eng., Biomedical Engineering",Campus Lyngby,"22055, ",Helge Bjarup Dissing Sørensen,22 Departmentof Health Technology,https://kurser.dtu.dk/course/22056
395,22100,R for Bio Data Science,R for Bio Data Science,5,"MSc_Offered as a single course_General competence course, MSc. Eng., Bioinformatics Systems Biology_Technological Core Course, Life Science and Technology",Campus Lyngby,"01005,02402,22110,27002,27008, .­,.­,.­(,/,) , The course assumes that the   student has experience in programming (language irrelevant),   statistics, mathematics and molecular biology corresponding to   the level of bachelor courses at DTU (see suggested course   numbers above).",Leon Eyrich Jessen,22 Departmentof Health Technology,https://kurser.dtu.dk/course/22100
396,22101,"Introduction to programming in Life Science using
Python",Introduktion til programmering i Life Science viaPython,5,"BSc_MSc_Offered as a single course_Projects and General Subjects, Human Life Science Engineering_Projects and General Subjects, Life Science and Technology",Campus Lyngby,,Peter Wad Sackett,22 Departmentof Health Technology,https://kurser.dtu.dk/course/22101
397,22107,"Research Immersion, Life Science","Forskningsfordybelse, Life Science",5,"MSc_General competence course, MSc. Eng., Bioinformatics Systems Biology",Campus Lyngby,"27015,  , or similar to 27015. Some of theprojects may have particular qualifiedprerequisites",Lars Rønn Olsen,22 Departmentof Health Technology,https://kurser.dtu.dk/course/22107
398,22110,Python and Unix for Bioinformaticians,Python og Unix for bioinformatikere,10,"MSc_Offered as a single course_Technological specialization course, MSc. Eng., Quantitative Biology and Disease Modelling_Technological specialization course, MSc. Eng., Pharmaceutical Design and Engineering",Campus Lyngby,,Peter Wad Sackett,22 Departmentof Health Technology,https://kurser.dtu.dk/course/22110
399,22111,Introduction to Bioinformatics,Introduktion til bioinformatik,5,"BSc_Offered as a single course_General competence course, MSc. Eng., Bioinformatics Systems Biology_Technology Core Courses, Biotechnology_Technology Core Courses, General Engineering_Technology Core Courses, Quantitative Biology and Disease Modelling_Technology Core Courses, Human Life Science Engineering_Technological Core Course, Life Science and Technology",Campus Lyngby,"27002,27008, /, , Basic understanding of biological   processes used in the industry. Knowledge of cell structure,   biological functions, biochemical and molecular biological   processes together with biotechnological   processes",Henrik Nielsen,22 Departmentof Health Technology,https://kurser.dtu.dk/course/22111
400,22112,High Performance Computing in Life Science,High Performance Computing i Life Science,5,"MSc_Offered as a single course_Technological Specialization Course, MSc. Eng., Bioinformatics and System Biologi",Campus Lyngby,"36610,22110,22113, /,/, , To be able to participate in the   course you must be very comfortable with programming and have   knowledge of Python. The course is based in Life Science and   knowledge of various biological file formats is   necessary.",Peter Wad Sackett,22 Departmentof Health Technology,https://kurser.dtu.dk/course/22112
401,22113,"Unix & Python Programming for
Bioinformaticians",Unix & Python Programming for bioinformatikere,10,"BSc_MSc_Offered as a single course_Technological Core Course, Life Science and Technology",Campus Lyngby,"22101,  , Practical experience in Pythonprogramming",Peter Wad Sackett,22 Departmentof Health Technology,https://kurser.dtu.dk/course/22113
402,22115,Computational Molecular Evolution,Molekylær evolution,5,"MSc_Offered as a single course_Technological Specialization Course, MSc. Eng., Bioinformatics and System Biologi",Campus Lyngby,"27002,27008,27611, /,.",Anders Gorm Pedersen,22 Departmentof Health Technology,https://kurser.dtu.dk/course/22115
403,22117,Protein structure and computational biology,"Proteinstruktur: Modeller, analyser og beregninger",5,"BSc_MSc_Offered as a single course_Technological specialization course, MSc. Eng., Advanced and Applied Chemistry_Technological specialization course, MSc. Eng., Quantitative Biology and Disease Modelling_Technological specialization course, MSc. Eng., Biotechnology_Technological specialization course, MSc. Eng., Pharmaceutical Design and Engineering_Technological Specialization Course, MSc. Eng., Bioinformatics and System Biologi",Campus Lyngby,"22111,22113,  and, , Basic knowledge of Bioinformaticsand Chemistry",Elena Papaleo,22 Departmentof Health Technology,https://kurser.dtu.dk/course/22117
404,22123,Computational Precision Medicine,Computational Precision medicine,5,"MSc_Offered as a single course_Technological specialization course, MSc. Eng., Quantitative Biology and Disease Modelling_Technological Specialization Course, MSc. Eng., Bioinformatics and System Biologi",Campus Lyngby,"02402,22110,22100,22126,27002,27008, .­,.­,.­,.­(,/,) , The course assumes that the   student has basic experience in R programming, as all exercises   and group assignments will be based on this language. A basic   understanding of next generation sequencing and a good   understanding of statistics are highly recommended.",Lars Rønn Olsen,22 Departmentof Health Technology,https://kurser.dtu.dk/course/22123
405,22125,Algorithms in bioinformatics,Algoritmer i bioinformatik,5,"MSc_Offered as a single course_Technological Specialization Course, MSc. Eng., Bioinformatics and System Biologi_Technological specialization course, MSc. Eng., Pharmaceutical Design and Engineering",Campus Lyngby,"22111,22110, ., , or equivalent. Able to solve   bioinformatic problems in a structured manner using simple   programs and scripts in Unix environment, for example during   project work.",Morten Nielsen,22 Departmentof Health Technology,https://kurser.dtu.dk/course/22125
406,22126,Next-Generation-Sequencing Analysis,Next-Generation-Sequencing Analyse,5,"MSc_Offered as a single course_General competence course, MSc. Eng., Bioinformatics Systems Biology_Technological specialization course, MSc. Eng., Quantitative Biology and Disease Modelling_Technological specialization course, MSc. Eng., Pharmaceutical Design and Engineering",Campus Lyngby,"27002,27008,27230,27430,22110, /,/,/,/, , Basic command line skills (i.e.   locate or copy files via command line)",Gabriel Renaud,22 Departmentof Health Technology,https://kurser.dtu.dk/course/22126
407,22140,Introduction to Systems Biology,Introduktion til Systembiologi,5,"BSc_Offered as a single course_Technology Core Courses, Biotechnology_Technology Core Courses, Human Life Science Engineering_Technological Core Course, Life Science and Technology",Campus Lyngby,"27002,27008,27022,27026,36611,22111, (,/,).­,.­,.­(,/,) , Knowledge of cell structure, its   biological function, subcomponents, biochemical and molecular   processes (metabolism, RNA- and protein synthesis), structure of   DNA, protein-coding genes, the standard genetic code, the   primary (sequence), secondary (helices/coils), tertiary (3D) and   quaternary (complex) structure of proteins. Basic knowledge and   ability to apply bioinformatics methods and the knowledge to   collect and process relevant biological data from large-scale   databases such as UniProt and GenBank.",Kristoffer Vitting-Seerup,22 Departmentof Health Technology,https://kurser.dtu.dk/course/22140
408,22145,Immunological Bioinformatics,Immunologisk bioinformatik,5,"MSc_Offered as a single course_Technological specialization course, MSc. Eng., Quantitative Biology and Disease Modelling_Technological specialization course, MSc. Eng., Pharmaceutical Design and Engineering_Technological Specialization Course, MSc. Eng., Bioinformatics and System Biologi",Campus Lyngby,"22111,27322,22117, .,., , or equivalent. NB! Prerequisite   courses in the DTU course base are recommended. This means, that   they are not mandatory per se, but the learning objectives   covered by the prerequisite courses are expected prior   knowledge. Students who do not fulfill the prerequisites are   expected to take independent responsibility for any missing   learning objectives. This means, that it is not impossible to   follow the course without having passed prerequisite courses,   but an additional work effort may be needed. Expected prior   knowledge covers basic immunology, basic bioinformatics, and   basic knowledge of amino acids and proteins. Contact course   responsible for any questions regarding   this.",Carolina Mercedes Barra Quaglia,22 Departmentof Health Technology,https://kurser.dtu.dk/course/22145
409,22175,"Algorithms in bioinformatics, PhD","Algoritmer i bioinformatik, Ph.d.",5,"Ph.D., Professionally focussed course_Offered as a single course",Campus Lyngby,"22111,22110, .,. , or equivalent. Able to solve   bioinformatic problems in a structured manner using simple   programs and scripts in Unix environment, for example during   project work.",Morten Nielsen,22 Departmentof Health Technology,https://kurser.dtu.dk/course/22175
410,22179,"Module 3: Value creation in pharma- and
biotechnology",Modul 3: Værdiskabelse i farma- og bioteknologi,5,"MSc_Offered as a single course_General competence course, MSc. Eng., Bioinformatics Systems Biology_General competence course, MSc. Eng., Pharmaceutical Design and Engineering",Campus Lyngby,,Federico De Masi,22 Departmentof Health Technology,https://kurser.dtu.dk/course/22179
411,22180,Design-build in Life Science,Design-build i Life Science,10,"BSc_Projects and General Subjects, Life Science and Technology",Campus Lyngby,"27000,27024,23214, .,.",Pernille Rose Jensen,22 Departmentof Health Technology,https://kurser.dtu.dk/course/22180
412,22200,Mucosal immunology,Slimhindens immunologi,5,"MSc_Technological specialization course, MSc. Eng., Quantitative Biology and Disease Modelling_Technological specialization course, MSc. Eng., Pharmaceutical Design and Engineering",Campus Lyngby,", General immunology (corresponding to 27322: Immunology).General knowledge of cell biology and physiology.",Vasileios Bekiaris,22 Departmentof Health Technology,https://kurser.dtu.dk/course/22200
413,22201,"Immune System, Anatomy & Development","Immunsystem, anatomi og udvikling",5,"MSc_Technological specialization course, MSc. Eng., Quantitative Biology and Disease Modelling_Technological specialization course, MSc. Eng., Pharmaceutical Design and Engineering",Campus Lyngby,"27322,  , General knowledge in Immunology(27322 or relevant) and cell biology",Vasileios Bekiaris,22 Departmentof Health Technology,https://kurser.dtu.dk/course/22201
414,22202,Molecular diagnostics and precision medicine,Molekylær diagnostik og præcisionsmedicin,5,"MSc_Offered as a single course_General competence course, MSc. Eng., Quantitative Biology and Disease Modelling_Technological specialization course, MSc. Eng. Biomaterial Engineering for Medicine_Technological specialization course, MSc. Eng., Pharmaceutical Design and Engineering",Campus Lyngby,"27231,27232, /, , or equivalent",Martin Dufva,22 Departmentof Health Technology,https://kurser.dtu.dk/course/22202
415,22203,"Conceive, Design, Implement, and Operate a Healthcare
Product","Udvikle, designe, implementere og betjene etsundhedsprodukt",10,"MSc_General competence course, MSc. Eng. Biomaterial Engineering for Medicine",Campus Lyngby,,Yi Sun,22 Departmentof Health Technology,https://kurser.dtu.dk/course/22203
416,22205,"Project in healthcare engineering, June","Projekt i Sundhedsteknologi, juni",5,"MSc_Technological specialization course, MSc. Eng. Biomaterial Engineering for Medicine",Campus Lyngby,,Martin Dufva,22 Departmentof Health Technology,https://kurser.dtu.dk/course/22205
417,22206,"Project in healthcare engineering, August","Projekt i Sundhedsteknologi, august",5,"MSc_Technological specialization course, MSc. Eng. Biomaterial Engineering for Medicine",Campus Lyngby,,Martin Dufva,22 Departmentof Health Technology,https://kurser.dtu.dk/course/22206
418,22207,"Project in healthcare engineering, January","Projekt i Sundhedsteknologi, januar",5,"MSc_Technological specialization course, MSc. Eng. Biomaterial Engineering for Medicine",Campus Lyngby,,Martin Dufva,22 Departmentof Health Technology,https://kurser.dtu.dk/course/22207
419,22208,Human Physiology,Human fysiologi,5,"BSc_Offered as a single course_Technological Core Course, Life Science and Technology_Technology Core Courses, Human Life Science Engineering",Campus Lyngby,"27002,27022,  /, , Insight and interest in lifesciences, organic chemistry and biochemistrydesirable.",Peter Mikael Helweg Heegaard,22 Departmentof Health Technology,https://kurser.dtu.dk/course/22208
420,22230,Development and production of vaccines,Udvikling og produktion af vacciner,5,"MSc_Offered as a single course_Technological specialization course, MSc. Eng., Pharmaceutical Design and Engineering",Campus Lyngby,"27322,  , The teaching will only briefly coverthe cellular and humoral elements of the immune system and how theimmune system reacts to infection. Thus it is a prerequisite thatthe student is already familiar with these elements of basicimmunology or achieves this knowledge in parallel e.g. by takingthe course in immunology (27322).",Peter Mikael Helweg Heegaard,22 Departmentof Health Technology,https://kurser.dtu.dk/course/22230
421,22231,"Module 1: From idea to project plan in biotech and
pharmaceutical research",Modul 1: Fra ide til projektplan i biotek- ogfarmaforskning,5,"MSc_General competence course, MSc. Eng., Quantitative Biology and Disease Modelling_General competence course, MSc. Eng., Bioinformatics Systems Biology_General competence course, MSc. Eng., Pharmaceutical Design and Engineering",Campus Lyngby,", The course is designed for execution just prior to the masterthesis project, and will link directly to a master thesis projectif such is known/selected. Alternatively a number of projects willbe presented during the course, and can be continuated into aMaster thesis project. This course can either stand alone or befollowed by module 2, 27691",Sine Reker Hadrup,22 Departmentof Health Technology,https://kurser.dtu.dk/course/22231
422,22232,Drug delivery – using nano and microtechnologies,Drug delivery - ved brug af nano- og mikroteknologier,5,"Ph.D., Service course (professional skills)",Campus Lyngby,", Basic knowledge about drug delivery",Line Hagner Nielsen,22 Departmentof Health Technology,https://kurser.dtu.dk/course/22232
423,22235,Drug delivery,Drug delivery,5,"MSc_Offered as a single course_Technological specialization course, MSc. Eng. Biomaterial Engineering for Medicine_Technological specialization course, MSc. Eng., Pharmaceutical Design and Engineering",Campus Lyngby,", A good basic understanding of chemistry (1 or more of medicinalchemistry, organic chemistry and physical chemistry) and biology (1or more of human physiology, eukaryotic cell biology and molecularbiology).",Andrew James Urquhart,22 Departmentof Health Technology,https://kurser.dtu.dk/course/22235
424,22236,Immunotherapy,Immunterapi,5,"MSc_Technological specialization course, MSc. Eng., Quantitative Biology and Disease Modelling_Technological specialization course, MSc. Eng. Biomaterial Engineering for Medicine_Technological specialization course, MSc. Eng., Pharmaceutical Design and Engineering",Campus Lyngby,"27322,  , Basic immunology course: 27322Immunology, or similar",Sine Reker Hadrup,22 Departmentof Health Technology,https://kurser.dtu.dk/course/22236
425,22237,Preclinical drug development,Præklinisk lægemiddeludvikling,5,"MSc_Offered as a single course_Technological specialization course, MSc. Eng., Pharmaceutical Design and Engineering",Campus Lyngby,,Line Hagner Nielsen,22 Departmentof Health Technology,https://kurser.dtu.dk/course/22237
426,22281,Biomaterials,Biomaterialer,5,"MSc_Offered as a single course_Technological specialization course, MSc. Eng., Advanced and Applied Chemistry_Technological specialization course, MSc. Eng. Biomaterial Engineering for Medicine_Technological specialization course, MSc. Eng., Biomedical Engineering",Campus Lyngby,", Basic materials science (fx 41684 or 41015), basic cell biology(fx KU011 or 27002)",Niels Bent Larsen,22 Departmentof Health Technology,https://kurser.dtu.dk/course/22281
427,22282,"Advanced Topics in Biomaterials Science and
Engineering",Avancerede emner inden for biomaterialer,5,"Ph.D., Professional identity course",Campus Lyngby,,Niels Bent Larsen,22 Departmentof Health Technology,https://kurser.dtu.dk/course/22282
428,22283,"Molecular thermodynamics, transport, and analytics","Molekylær termodynamik, transport og analyse",10,"MSc_Offered as a single course_General competence course, MSc. Eng. Biomaterial Engineering for Medicine_Technological specialization course, MSc. Eng. Engineering Physics",Campus Lyngby,", 02402 or similar introductory statistics; 26000 or similargeneral chemistry; 26202 or similar introductory physicalchemistry; 27008 or similar introductory life science orbiochemistry",Jonas Nyvold Pedersen,22 Departmentof Health Technology,https://kurser.dtu.dk/course/22283
429,22284,Living models of body barriers and organs,Levende modeller af kropsbarrierer og organer,5,"MSc_Offered as a single course_Technological specialization course, MSc. Eng. Biomaterial Engineering for Medicine_Technological specialization course, MSc. Eng., Pharmaceutical Design and Engineering",Campus Lyngby,", Basic cell biology (e.g. KU011 or27002)",Niels Bent Larsen,22 Departmentof Health Technology,https://kurser.dtu.dk/course/22284
430,22285,Applied Biomaterials,Anvendte Biomaterialer,5,BSc_MSc,Campus Lyngby,", Basic courses in biology and chemistry",Andrew James Urquhart,22 Departmentof Health Technology,https://kurser.dtu.dk/course/22285
431,22400,"Design-build 4: Autonomous devices for controlling and
studying living systems",Design-build 4: Autonome komponenter til styring af og studieri levende systemer,5,"BSc_Projects and General Subjects, General Engineering",Campus Lyngby,,Martin Dufva,22 Departmentof Health Technology,https://kurser.dtu.dk/course/22400
432,22403,Micro and Nano Sensors,Mikro- og Nanosensorer,5,"Ph.D., Service course (professional skills)_Offered as a single course",Campus Lyngby,", Basic knowledge of microfabrication and surfacechemistry",Anja Boisen,22 Departmentof Health Technology,https://kurser.dtu.dk/course/22403
433,22433,Rapid Prototyping of Simple Sensor Systems,Rapid prototyping af simple sensorsystemer,10,BSc_Offered as a single course,Campus Lyngby,,Kaj-Åge Henneberg,22 Departmentof Health Technology,https://kurser.dtu.dk/course/22433
434,22435,Biomedical product development,Medikoteknisk produktudvikling,10,"MSc_General competence course, MSc. Eng., Biomedical Engineering",Campus Lyngby,,Jens E. Wilhjelm,22 Departmentof Health Technology,https://kurser.dtu.dk/course/22435
435,22437,"Rapid Prototyping of AC Sensor Systems using Arduino
Technology",Rapid prototyping af AC sensorsystemer med Arduinoteknologi,10,BSc_Offered as a single course,Campus Lyngby,"22433, ",Kaj-Åge Henneberg,22 Departmentof Health Technology,https://kurser.dtu.dk/course/22437
436,22446,"Engineering World Health Summer School in Biomedical
Instrumentation",Engineering World Health Sommerskole i medicotekniskinstrumentering,5,"MSc_Technological specialization course, MSc. Eng., Biomedical Engineering",Campus Lyngby,"31001,22433, /, , It is an advantage, but not a   requirement, to have prior course work in electric circuits and   human physiology.",Kaj-Åge Henneberg,22 Departmentof Health Technology,https://kurser.dtu.dk/course/22446
437,22451,Physiological fluid mechanics,Fysiologisk fluidmekanik,5,"BSc_Offered as a single course_Technology Core Courses, Medicine and Technology",Campus Lyngby,"01005,  , Differential equations, vectoranalysis, mechanics",Marie Sand Traberg,22 Departmentof Health Technology,https://kurser.dtu.dk/course/22451
438,22475,Tissue and movement biomechanics DTU,Vævs- og bevægeapparatets biomekanik DTU,10,"MSc_Offered as a single course_Technological specialization course, MSc. Eng., Biomedical Engineering",Campus Lyngby A lab exercise is conducted at the Panum Institute during thecourse.,"41501,  , Strength of materials, mechanics,vector analysis",Marie Sand Traberg,22 Departmentof Health Technology,https://kurser.dtu.dk/course/22475
439,22481,Introduction to medical imaging,Indledende medicinsk billeddannelse,5,"BSc_Offered as a single course_Technology Core Courses, Medicine and Technology",Campus Lyngby At least one of the 13 teaching modules is conducted atBispebjerg hospital.,", Physiology and anatomy. Good knowledge of MATLAB is essential.Basic knowledge of nuclear physics.",Jens E. Wilhjelm,22 Departmentof Health Technology,https://kurser.dtu.dk/course/22481
440,22485,Medical imaging systems,Medicinske billedsystemer,10,"MSc_Offered as a single course_Technological specialization course, MSc. Eng., Biomedical Engineering",Campus Lyngby,"31540,22481,31658,31610,31561,22052,02451, (,/,).­,/,.­(,/,)/, , Courses in signal processing and   biomedical engineering",Jørgen Arendt Jensen,22 Departmentof Health Technology,https://kurser.dtu.dk/course/22485
441,22486,Literature study in medical ultrasound,Litteraturstudie i medicinsk ultralyd,5,"Ph.D., Professionally focussed course",Campus Lyngby,,Jørgen Arendt Jensen,22 Departmentof Health Technology,https://kurser.dtu.dk/course/22486
442,22487,Advanced ultrasound research tools,Avancerede forskningsværktøjer til medicinsk ultralyd,10,"Ph.D., Professionally focussed course",Campus Lyngby,,Jørgen Arendt Jensen,22 Departmentof Health Technology,https://kurser.dtu.dk/course/22487
443,22506,Medical magnetic resonance imaging,Magnetisk resonans i medicinsk billeddannelse,5,"MSc_Offered as a single course_Technological specialization course, MSc. Eng., Biomedical Engineering",Campus Lyngby,"22485,http:/​/​eprints.drcmr.dk/​37/​,  , Knowledge of MRI corresponding tonotes at,is required (until and including k-space) and the correspondingmathematical formalism covered in course 22485. A questionnairecovering course prerequisites is available on the course homepagefor repetion ahead of the course, but also to give participants nothaving taken 22485 insight into what they need to study themselvesin advance. Limited programming experience is needed, e.g.Matlab.",Lars G. Hanson,22 Departmentof Health Technology,https://kurser.dtu.dk/course/22506
444,22507,Advanced magnetic resonance imaging,Avancerede emner indenfor Magnetisk Resonansbilleddannelse,5,MSc_Offered as a single course,Campus Lyngby,"22506,  , The course requires extensive priorMR knowledge corresponding to the end level of DTU course 22506Medical Magnetic Resonance Imaging.",Axel Thielscher,22 Departmentof Health Technology,https://kurser.dtu.dk/course/22507
445,22508,"Practical NMR spectroscopy: Making reactions in
(bio)chemistry visible",Praktisk NMR spektroskopi: Synliggør reaktioner i (bio)kemiskesystemer,5,"MSc_Technological specialization course, MSc. Eng., Advanced and Applied Chemistry_Technological specialization course, MSc. Eng., Pharmaceutical Design and Engineering_Technological specialization course, MSc. Eng., Biomedical Engineering",Campus Lyngby,,Pernille Rose Jensen,22 Departmentof Health Technology,https://kurser.dtu.dk/course/22508
446,22510,Biomedical prototyping,Medikoteknisk prototyping,5,"BSc_Technology Core Courses, Medicine and Technology",Campus Lyngby The course takes place in DTU Skylab,,Emil Boye Kromann,22 Departmentof Health Technology,https://kurser.dtu.dk/course/22510
447,22511,Biomedical optics,Bio-medicinsk optik,5,"MSc_Offered as a single course_Technological specialization course, MSc. Eng. Engineering Physics_Technological specialization course, MSc. Eng. Engineering Light_Technological specialization course, MSc. Eng., Biomedical Engineering",Campus Lyngby,"10036,  , Basic courses in mathematics andphysics Med-tech",Peter Eskil Andersen,22 Departmentof Health Technology,https://kurser.dtu.dk/course/22511
