,Course id,English title,Danish title,Point( ECTS ),Course type,Location,Recommended prerequisites,Responsible,Department,Link
839,34029,Physics project,Fagprojekt (fysik og nanoteknologi),10,"BSc_Projects and General Subjects, Physics and Nanotechnology",Campus Lyngby,"10030, ",Niels Gregersen,34 Department of Electrical and Photonics Engineering,https://kurser.dtu.dk/course/34029
840,34031,Applied mathematics for physicists,Anvendt matematik for fysikere,5,BSc_Offered as a single course,Campus Lyngby,"01005,10036,10020, .,.",Ole Bang,34 Department of Electrical and Photonics Engineering,https://kurser.dtu.dk/course/34031
841,34032,Optical properties of solids,Faststofoptik,5,"MSc_Offered as a single course_General competence course, MSc. Eng. Engineering Physics_Technological specialization course, MSc. Eng., Communication Technologies and System Design_Technological specialization course, MSc. Eng. Engineering Light",Campus Lyngby,"10036,10102,10303,34033, .,.,   ., , can be taken at the same   time",Nicolas Leitherer-Stenger,34 Department of Electrical and Photonics Engineering,https://kurser.dtu.dk/course/34032
842,34034,Lasers and photonic systems,Lasere og fotoniske systemer,5,"MSc_Offered as a single course_General competence course, MSc. Eng. Engineering Light_Technological specialization course, MSc. Eng. Engineering Physics_Technological specialization course, MSc. Eng., Communication Technologies and System Design",Campus Lyngby,"34021,34020,34127,34033,10370, /,/,/,/",Peter Tidemand-Lichtenberg,34 Department of Electrical and Photonics Engineering,https://kurser.dtu.dk/course/34034
843,34038,Optical design and modelling,Optisk design og modellering,5,BSc_Offered as a single course,Risø campus,"34020,34021, /",Michael Linde Jakobsen,34 Department of Electrical and Photonics Engineering,https://kurser.dtu.dk/course/34038
844,34041,Waveguide optics,Bølgelederoptik,5,"MSc_Offered as a single course_General competence course, MSc. Eng. Engineering Light_Technological specialization course, MSc. Eng. Engineering Physics",Campus Lyngby,"10036,31400,34020,34021, /,/,/, , Knowledge of Maxwells field   equations, and the electromagnetic wave equation. Knowledge of   vector mathematics, calculus, and differential   equations.",Jesper Lægsgaard,34 Department of Electrical and Photonics Engineering,https://kurser.dtu.dk/course/34041
845,34042,Quantum photonic communication,Kvantefotonisk kommunikation,5,"MSc_Offered as a single course_Technological specialization course, MSc. Eng. Engineering Physics_Technological specialization course, MSc. Eng. Engineering Light",Campus Lyngby,"10102, ",Nika Akopian,34 Department of Electrical and Photonics Engineering,https://kurser.dtu.dk/course/34042
846,34043,Projects in Optics and Photonics,Projekter i Optik og Fotonik,5,"MSc_General competence course, MSc. Eng. Engineering Light_Technological specialization course, MSc. Eng. Engineering Physics",Campus Lyngby,,Karsten Rottwitt,34 Department of Electrical and Photonics Engineering,https://kurser.dtu.dk/course/34043
847,34046,Experimental methods in photonics,Experimental methods in photonics,5,"MSc_General competence course, MSc. Eng. Engineering Light_Technological specialization course, MSc. Eng. Engineering Physics",Campus Lyngby,"34020,34021, /",Yiyu Ou,34 Department of Electrical and Photonics Engineering,https://kurser.dtu.dk/course/34046
848,34051,Nanophotonics,Nanofotonik,10,"MSc_Offered as a single course_General competence course, MSc. Eng. Engineering Light_Technological specialization course, MSc. Eng. Engineering Physics_Technological specialization course, MSc. Eng., Communication Technologies and System Design_Technological specialization course, MSc. Eng. Engineering Light",Campus Lyngby,"34032,34041,10102,34153,10102, /(,.­,)/(,.­,)",Jesper Mørk,34 Department of Electrical and Photonics Engineering,https://kurser.dtu.dk/course/34051
849,34052,Nonlinear optics,Ikke-lineær optik,10,"MSc_Offered as a single course_General competence course, MSc. Eng. Engineering Light_Technological specialization course, MSc. Eng. Engineering Physics",Campus Lyngby,"10036,10370,34031,34530, /,.,/",Karsten Rottwitt,34 Department of Electrical and Photonics Engineering,https://kurser.dtu.dk/course/34052
850,34053,Numerical methods in photonics,Numeriske metoder i fotonik,5,"MSc_Offered as a single course_General competence course, MSc. Eng. Engineering Physics_Technological specialization course, MSc. Eng. Engineering Light",Campus Lyngby,"10036,31400,10370,34041, /,.,/, , Knowledge of Matlab is an   advantage.",Andrei Laurynenka,34 Department of Electrical and Photonics Engineering,https://kurser.dtu.dk/course/34053
851,34060,Ultrafast optics: fundamentals and applications,Ultrahurtig optik: fundament og anvendelser,5,"MSc_Offered as a single course_Technological specialization course, MSc. Eng. Engineering Physics_Technological specialization course, MSc. Eng. Engineering Light",Campus Lyngby,"34034,34052, /,. Some knowledge of scientific   programming in Python would be beneficial. , Bachelor's   degree in science or technical subjects. It is not advisable to   follow the course without basic knowledge of lasers and   non-linear optics, as this can result in considerable extra work   compared to the standard. It is recommended that courses 34034,   34052 have been passed.",Edmund Kelleher,34 Department of Electrical and Photonics Engineering,https://kurser.dtu.dk/course/34060
852,34061,Optical metrology and signal analysis,Optiske målemetoder og signal analyse,10,"MSc_Offered as a single course_Technological specialization course, MSc. Eng. Engineering Light",Campus Lyngby,"34020,34021,30160,22050,22051, (,/,).­(,/(,.­,))",Michael Linde Jakobsen,34 Department of Electrical and Photonics Engineering,https://kurser.dtu.dk/course/34061
853,34091,"PhD Course - Advanced photonic devices journal
club",Ph.d.-kursus - Studiekreds indenfor avancerede fotoniskekomponenter,5,"Ph.D., Professional identity course_Offered as a single course",Campus Lyngby,", Basic knowledge of semiconductors and optics",Kresten Yvind,34 Department of Electrical and Photonics Engineering,https://kurser.dtu.dk/course/34091
854,34092,PhD Course - Nano-optics,Ph.d.-kursus - Nano-optik,5,"Ph.D., Professional identity course_Offered as a single course",Campus Lyngby,,Niels Gregersen,34 Department of Electrical and Photonics Engineering,https://kurser.dtu.dk/course/34092
855,34094,PhD Course - Quantum Information Journal Club,Ph.d.-kursus - Studiegruppe om Kvanteinformation,5,"Ph.D., Professional identity course_Offered as a single course",Campus Lyngby,,Niels Gregersen,34 Department of Electrical and Photonics Engineering,https://kurser.dtu.dk/course/34094
856,34120,Electromagnetism for communication,Elektromagnetisme for kommunikation,5,"BSc_Offered as a single course_Basic Natural Science Courses, Design & Innovation_Technology Core Courses, Cybertechnology",Campus Lyngby,"01005, ",Karsten Rottwitt,34 Department of Electrical and Photonics Engineering,https://kurser.dtu.dk/course/34120
857,34121,Introduction to Fibre Optic Communications,Introduktion til fiberoptisk kommunikation,5,"BSc_Offered as a single course_Technology Core Courses, Cybertechnology",Campus Lyngby,"34120, ",Toshio Morioka,34 Department of Electrical and Photonics Engineering,https://kurser.dtu.dk/course/34121
858,34126,Experimental course in optical communication,Eksperimentelt kursus i optisk kommunikation,5,BSc_Offered as a single course,Campus Lyngby,,Michael Galili,34 Department of Electrical and Photonics Engineering,https://kurser.dtu.dk/course/34126
859,34127,Experimental optics and photonics,Eksperimentel optik og fotonik,5,"BSc_Technology Core Courses, Physics and Nanotechnology",Campus Lyngby,"34020,34021, /, , Optic and photonic",Yiyu Ou,34 Department of Electrical and Photonics Engineering,https://kurser.dtu.dk/course/34127
860,34129,Experimental course in optical communication,Eksperimentelt kursus i optisk kommunikation,5,BSc_Offered as a single course,Campus Lyngby,,Michael Galili,34 Department of Electrical and Photonics Engineering,https://kurser.dtu.dk/course/34129
861,34130,Fundamentals of fibre-optic communication systems,Grundkursus i fiber-optiske kommunikationssystemer,10,"MSc_Offered as a single course_General competence course, MSc. Eng., Communication Technologies and System Design_Technological specialization course, MSc. Eng., Communication Technologies and System Design_Technological specialization course, MSc. Eng. Engineering Light",Campus Lyngby,"34120,31400,10036,34210,34230, /,/,/,/, , Basic experience with Matlab   programming.",Anders Clausen,34 Department of Electrical and Photonics Engineering,https://kurser.dtu.dk/course/34130
862,34153,Physical concepts in optical communication,Fysiske koncepter i optisk kommunikation,5,"MSc_Offered as a single course_Technological specialization course, MSc. Eng. Engineering Physics_Technological specialization course, MSc. Eng., Communication Technologies and System Design_Technological specialization course, MSc. Eng. Engineering Light",Campus Lyngby,"10370,34033,34020,34032,34021, /,/,/,/",Michael Galili,34 Department of Electrical and Photonics Engineering,https://kurser.dtu.dk/course/34153
863,34156,Advanced Optical Communication Systems,Avancerede optiske kommunikationssystemer,5,"MSc_Offered as a single course_Technological specialization course, MSc. Eng., Communication Technologies and System Design_Technological specialization course, MSc. Eng. Engineering Light",Campus Lyngby,"34130,34153,34210,  /,/",Leif Katsuo Oxenløwe,34 Department of Electrical and Photonics Engineering,https://kurser.dtu.dk/course/34156
864,34190,"PhD Course - Digital Optical Communication
Receivers",Ph.d.-kursus - Digitale modtagere for optiskkommunikation,5,"Ph.D., Professionally focussed course_Offered as a single course",Campus Lyngby,", Principles of digital communications, Introduction to digitalsignal processing, Matlab programming Opticalcommunications",Darko Zibar,34 Department of Electrical and Photonics Engineering,https://kurser.dtu.dk/course/34190
865,34192,Optical Communications Journal Club,Optical Communications Journal Club,5,"Ph.D., Professional identity course_Offered as a single course",Campus Lyngby,"34130,34150, ., , A basic knowledge of optical   communication systems such as obtained in the course   34130.",Leif Katsuo Oxenløwe,34 Department of Electrical and Photonics Engineering,https://kurser.dtu.dk/course/34192
866,34193,PhD Course - Advanced Concepts in Photovoltaics,Ph.d.-kursus - Avancerede solcellekoncepter,5,"Ph.D., Service course (professional skills)_Offered as a single course",Will be announced later.,", Knowledge within photonics, optics, nanotechnology, chemistryand physics would be beneficiary",Peter Behrensdorff Poulsen,34 Department of Electrical and Photonics Engineering,https://kurser.dtu.dk/course/34193
867,34194,PhD Course - Advanced experimental practices,Ph.d.-kursus - Avancerede eksperimentelle metoder,5,"Ph.D., Professional identity course",Campus Lyngby,,Francesco Da Ros,34 Department of Electrical and Photonics Engineering,https://kurser.dtu.dk/course/34194
868,34210,Introduction to digital communication,Introduktion til digital kommunikation,5,"BSc_Offered as a single course_Technology Core Courses, Cybertechnology",Campus Lyngby,"01005,  , 01005 (at the sametime)",Darko Zibar,34 Department of Electrical and Photonics Engineering,https://kurser.dtu.dk/course/34210
869,34220,Coding in communication systems,Kodning i kommunikationssystemer,5,"BSc_Offered as a single course_Technology Core Courses, Cybertechnology",Campus Lyngby,"01005, ",Søren Forchhammer,34 Department of Electrical and Photonics Engineering,https://kurser.dtu.dk/course/34220
870,34229,Project Work – Bachelor in Cyber Technology,Fagprojekt – Bachelor i Cyberteknologi,10,"BSc_Projects and General Subjects, Cybertechnology",Campus Lyngby,"34302,34313,34334, .,., , Knowledge of programming   languages. Knowledge of VHDL is an   advantage.",Henrik Wessing,34 Department of Electrical and Photonics Engineering,https://kurser.dtu.dk/course/34229
871,34230,Digital communication,Digital kommunikation,10,"MSc_Offered as a single course_General competence course, MSc. Eng., Communication Technologies and System Design_Technological specialization course, MSc. Eng., Communication Technologies and System Design",Campus Lyngby,"01035,02451,31605,31606,02405, /,/,/,.­",Søren Forchhammer,34 Department of Electrical and Photonics Engineering,https://kurser.dtu.dk/course/34230
872,34240,"Data Science, Compression and Image Communication","Data science, kompression og billedkommunikation",5,"MSc_Offered as a single course_Technological specialization course, MSc. Eng., Communication Technologies and System Design",Campus Lyngby,"34220,34230,02502,02451,31610, /,/,/,/, , or courses in image and signal   processing",Søren Forchhammer,34 Department of Electrical and Photonics Engineering,https://kurser.dtu.dk/course/34240
873,34241,Digital video technology,Digital videoteknologi,5,"MSc_Offered as a single course_Technological specialization course, MSc. Eng., Communication Technologies and System Design",Campus Lyngby,", 34220/​34230/​34240/​34310/​02502. Experience with Matlab orPython required",Søren Forchhammer,34 Department of Electrical and Photonics Engineering,https://kurser.dtu.dk/course/34241
874,34249,Synthesis Project for Communication Technologies,Synteseprojekt for Kommunikationsteknologier,10,"MSc_General competence course, MSc. Eng., Communication Technologies and System Design_Technological specialization course, MSc. Eng., Communication Technologies and System Design",Campus Lyngby,"34310,34130,34330,34230,34350, /,/,/,/, , Knowledge of programming   languages. Knowledge of VHDL is an   advantage.",Henrik Wessing,34 Department of Electrical and Photonics Engineering,https://kurser.dtu.dk/course/34249
875,34250,Advanced image and video coding,Avanceret billed- og videokodning,5,"MSc_Offered as a single course_Technological specialization course, MSc. Eng., Communication Technologies and System Design",Campus Lyngby,"34240,34241, /, , or knowledge of image or video   coding",Søren Forchhammer,34 Department of Electrical and Photonics Engineering,https://kurser.dtu.dk/course/34250
876,34251,"Advanced forward error correction and iterative
decoding",Avancerede kodningssystemer med iterativedekodningsmetoder,5,"MSc_Offered as a single course_Technological specialization course, MSc. Eng., Communication Technologies and System Design",Campus Lyngby,"01405,30300,34230,02405, /,/,., , Good experience in MATLAB is   required. C/C++ may be alternatives, but MATLAB is used in   examples",Søren Forchhammer,34 Department of Electrical and Photonics Engineering,https://kurser.dtu.dk/course/34251
877,34269,Computational imaging and spectroscopy,Computational billedbehandling og spektroskopi,5,"MSc_Offered as a single course_Technological specialization course, MSc. Eng. Engineering Physics",Campus Lyngby,", Matlab or Python programming",Thierry Silvio Claude Soreze,34 Department of Electrical and Photonics Engineering,https://kurser.dtu.dk/course/34269
878,34290,PhD Course - Information Theory,Ph.d.-kursus - Informationsteori,5,"Ph.D., Professionally focussed course_Offered as a single course",Campus Lyngby,,Søren Forchhammer,34 Department of Electrical and Photonics Engineering,https://kurser.dtu.dk/course/34290
879,34302,Introduction to Cyber Technology,Introduktion til Cyberteknologi,10,"BSc_Projects and General Subjects, Cybertechnology",Campus Lyngby,,Henrik Wessing,34 Department of Electrical and Photonics Engineering,https://kurser.dtu.dk/course/34302
880,34313,Introduction to Data Communication Networks,Introduktion til datanet,5,"BSc_Offered as a single course_Technology Core Courses_Technology Core Courses, Cybertechnology",Campus Lyngby,,Lars Staalhagen,34 Department of Electrical and Photonics Engineering,https://kurser.dtu.dk/course/34313
881,34315,"Internet of things – application and infrastructure
implementation",Internet of things – applikation og infrastrukturudvikling,5,BSc_Offered as a single course,Campus Lyngby,", Interested in working in the lab, developing hardwareprototypes, and embedded programming.",Sarah Renée Ruepp,34 Department of Electrical and Photonics Engineering,https://kurser.dtu.dk/course/34315
882,34318,Programming projects for Cyber Technology,Programmeringsprojekt for Cyberteknologi,5,BSc,Campus Lyngby,"02101,02102,34311,34312,34313,02105,02161, /, .   ,/,/, .   ,/, , Participation in the course   assumes a general knowledge of modern communication networks and   protocols in addition to software development in   Java.",Lars Staalhagen,34 Department of Electrical and Photonics Engineering,https://kurser.dtu.dk/course/34318
883,34322,"Communication Network for Control and Data
Acquisition",Kommunikationsnetværk til styring og dataopsamling,5,BSc_Technology Core Courses,Campus Lyngby,,Henrik Wessing,34 Department of Electrical and Photonics Engineering,https://kurser.dtu.dk/course/34322
884,34323,"Modelling and simulation of communication networks and
protocols",Modellering og simulering af kommunikationsnetværk og–protokoller,5,MSc_Offered as a single course,Campus Lyngby,"34330,34334,34341,34350,34355,34368, /,/,/,/,/, , General knowledge of modern   communication systems and protocols. General experience with   software development in C/C++.",Lars Staalhagen,34 Department of Electrical and Photonics Engineering,https://kurser.dtu.dk/course/34323
885,34324,Analogue design,Analog design,5,"BEng_Offered as a single course_Mandatory course, Bachelor of Engineering Electrical Engineering",Campus Lyngby,"31022,62732,01964, .,.   , , Analog electronics. Mathematics   2",Michael Stübert Berger,34 Department of Electrical and Photonics Engineering,https://kurser.dtu.dk/course/34324
886,34331,Digital Hardwaredesign for Communications,Digital hardwaredesign til kommunikation,5,"BSc_Technology Core Courses, Cybertechnology",Campus Lyngby,,Michael Stübert Berger,34 Department of Electrical and Photonics Engineering,https://kurser.dtu.dk/course/34331
887,34332,"Projects in Digital hardwaredesign for
Communications",Projekter i digital hardwaredesign til kommunikation,5,BSc,Campus Lyngby,"34331,  ellertilsvarende",Michael Stübert Berger,34 Department of Electrical and Photonics Engineering,https://kurser.dtu.dk/course/34332
888,34333,Technologies for Mobile communication and IoT,Teknologier til mobilkommunikation og IoT,5,"BSc_Technology Core Courses, Cybertechnology",Campus Lyngby,"34313,  , Participation in the course assumesknowledge in general about concepts such as services, signallingand protocols in modern networks fortelecommunication.",Lars Dittmann,34 Department of Electrical and Photonics Engineering,https://kurser.dtu.dk/course/34333
889,34334,Advanced Data Networks and Cyber Security,Avancerede datanet og cybersikkerhed,5,"BSc_Technology Core Courses, Cybertechnology",Campus Lyngby,"34313,34311,34322,02101,02102, /,/,.­,/,/(tilsvarende komptetencer i f.eks.   Python)",Henrik Wessing,34 Department of Electrical and Photonics Engineering,https://kurser.dtu.dk/course/34334
890,34338,"Telecommunication programming projects with
Arduino",Telekommunikations programmerings projekter medArduino,5,BSc_Offered as a single course,Campus Lyngby,", Basic programming skills",Martin Nordal Petersen,34 Department of Electrical and Photonics Engineering,https://kurser.dtu.dk/course/34338
891,34339,Experimental mobile communication,Eksperimentel mobilkommunikation,5,"MSc_Offered as a single course_Technological specialization course, MSc. Eng., Communication Technologies and System Design",Campus Lyngby,"34330, ",Lars Dittmann,34 Department of Electrical and Photonics Engineering,https://kurser.dtu.dk/course/34339
892,34343,Mobile backhaul networks,Mobile backhaul networks,5,"MSc_Offered as a single course_Technological specialization course, MSc. Eng., Communication Technologies and System Design",Campus Lyngby,"34330, ",Lars Dittmann,34 Department of Electrical and Photonics Engineering,https://kurser.dtu.dk/course/34343
893,34345,Signalling systems and technology for railways,Signalsystemer og teknologi for jernbaner,5,"MSc_Offered as a single course_Technological specialization course, MSc. Eng., Transportation and Logistics",Campus Lyngby,"13124,13125,13524,13525, /,/,/, , 11404/62276/62622 ( previously   13124/13125/13524/13525) for Transport and Logistic line, OR   34311/34313/34347/34323 for Telecommunication line. Can be all   taken during the same semester",José Francisco Soler Lucas,34 Department of Electrical and Photonics Engineering,https://kurser.dtu.dk/course/34345
894,34346,"Networking technologies and application development for
Internet of Things (IoT)",Netværksteknologier og applikationsudvikling til Internet ofThings,5,"MSc_Offered as a single course_Technology Core Courses, Cybertechnology_Technological specialization course, MSc. Eng., Communication Technologies and System Design",Campus Lyngby,"34315,34338, Either/enten , or, or Arduino experience. , Interested inworking in the lab, developing hardware prototypes, and embeddedprogramming",Martin Nordal Petersen,34 Department of Electrical and Photonics Engineering,https://kurser.dtu.dk/course/34346
895,34347,"Modelling and simulation of communication networks and
protocols",Modellering og simulering af kommunikationsnetværk og–protokoller,5,"MSc_Offered as a single course_Technological specialization course, MSc. Eng., Communication Technologies and System Design",Campus Lyngby,"34330,34334,34341,34350,34355,34368, /,/,/,/,/, , General knowledge of modern   communication systems and protocols. General experience with   software development in C/C++.",Lars Staalhagen,34 Department of Electrical and Photonics Engineering,https://kurser.dtu.dk/course/34347
896,34349,FPGA design for communication systems,FPGA design til kommunikationssystemer,10,"MSc_Offered as a single course_General competence course, MSc. Eng., Communication Technologies and System Design_Technological specialization course, MSc. Eng., Electrical Engineering_Technological specialization course, MSc. Eng., Communication Technologies and System Design",Campus Lyngby,"02139,34310, .",Michael Stübert Berger,34 Department of Electrical and Photonics Engineering,https://kurser.dtu.dk/course/34349
897,34351,Access- and home networks,Access- og hjemmenet,5,"MSc_Offered as a single course_Technological specialization course, MSc. Eng., Communication Technologies and System Design",Campus Lyngby,"34310,34311, /",Lars Dittmann,34 Department of Electrical and Photonics Engineering,https://kurser.dtu.dk/course/34351
898,34352,Advanced protocols,Videregående protokoller,"7,5","MSc_Offered as a single course_Technological specialization course, MSc. Eng., Communication Technologies and System Design",Campus Lyngby,"34350, ",Lars Dittmann,34 Department of Electrical and Photonics Engineering,https://kurser.dtu.dk/course/34352
899,34357,Telecommunication services,Telekommunikationstjenester,10,"MSc_Offered as a single course_General competence course, MSc. Eng., Communication Technologies and System Design_Technological specialization course, MSc. Eng., Communication Technologies and System Design",Campus Lyngby,"34302,34313,34323,34347,02815, .­,.­,/,/",José Francisco Soler Lucas,34 Department of Electrical and Photonics Engineering,https://kurser.dtu.dk/course/34357
900,34359,SDN: software-defined networking,SDN: software-defineret netværk,5,"MSc_Offered as a single course_Technological specialization course, MSc. Eng., Communication Technologies and System Design",Campus Lyngby,"34302,34313,34351,34357,34323,34347, .­,.­,.­,.­,/",José Francisco Soler Lucas,34 Department of Electrical and Photonics Engineering,https://kurser.dtu.dk/course/34359
901,34365,IoT Prototyping,Prototyper for internet of things,5,"MSc_Offered as a single course_General competence course, MSc. Eng., Communication Technlogies and System Design_Technological specialization course, MSc. Eng., Design and Innovation_Technological specialization course, MSc. Eng., Electrical Engineering_Technological specialization course, MSc. Eng., Communication Technologies and System Design",Campus Lyngby,"34315,34338,34346, Either/enten , or/eller, or/eller",Sarah Renée Ruepp,34 Department of Electrical and Photonics Engineering,https://kurser.dtu.dk/course/34365
902,34366,Intelligent systems,Intelligente systemer,5,"MSc_Offered as a single course_General competence course, MSc. Eng., Autonomous Systems_General competence course, MSc. Eng., Electrical Engineering_Technological specialization course, MSc. Eng., Autonomous Systems_Technological specialization course, MSc. Eng., Electrical Engineering_Technological specialization course, MSc. Eng., Communication Technologies and System Design_Technological specialization course, MSc. Eng., Transportation and Logistics",Campus Lyngby,", Experience with script programming (e.g. MATLAB, Python, etc.)and object-oriented programming (e.g. Java, C++, or pythonetc.).",Lars Dittmann,34 Department of Electrical and Photonics Engineering,https://kurser.dtu.dk/course/34366
903,34367,Project in Intelligent Systems,Projekt i Intelligente Systemer,5,"MSc_Offered as a single course_General competence course, MSc. Eng., Autonomous Systems_General competence course, MSc. Eng., Electrical Engineering_Technological specialization course, MSc. Eng., Electrical Engineering_Technological specialization course, MSc. Eng., Communication Technologies and System Design",Campus Lyngby,"34666,  , The course is based on the projectdescription that was an assignment in course 34366.",Lars Dittmann,34 Department of Electrical and Photonics Engineering,https://kurser.dtu.dk/course/34367
